{
  "$schema": "https://json-schema.org/draft/2020-12/schema",
  "$id": "https://project-atlas.dev/schemas/project-profile.schema.json",
  "type": "object",
  "required": ["version", "project", "ai"],
  "properties": {
    "version": {"type": "integer", "minimum": 1},
    "project": {
      "type": "object",
      "required": ["name", "type"],
      "properties": {
        "name": {"type": "string", "minLength": 1},
        "type": {
          "oneOf": [
            {"type": "string", "minLength": 1},
            {"type": "array", "minItems": 1, "items": {"type": "string", "minLength": 1}}
          ]
        }
      },
      "additionalProperties": true
    },
    "stack": {"type": "object"},
    "features": {"type": "array", "items": {"type": "string"}},
    "risk": {"type": "array", "items": {"type": "string"}},
    "quality": {"type": "object"},
    "ai": {
      "type": "object",
      "required": ["preferred_models"],
      "properties": {
        "orchestrator": {"type": "string"},
        "autonomy": {"enum": ["controlled", "agentic", "autonomous"]},
        "preferred_models": {
          "type": "array",
          "minItems": 1,
          "items": {
            "type": "object",
            "required": ["id"],
            "properties": {
              "id": {"type": "string", "minLength": 1},
              "provider": {"type": "string"},
              "notes": {"type": "string"}
            },
            "additionalProperties": true
          }
        },
        "role_preferences": {"type": "object"}
      },
      "additionalProperties": true
    }
  },
  "additionalProperties": true
}
