{
  "version": 2,
  "project": {
    "name": "Brasa",
    "type": ["game-engine", "desktop"]
  },
  "stack": {
    "languages": ["rust", "ori"],
    "runtime": ["fyrox"],
    "scripting": ["ori", "ori-embed"],
    "tooling": ["fyroxed", "brasa-cli"]
  },
  "features": ["rendering", "sprites", "tilemaps", "ui", "editor", "physics", "collision", "lighting", "postfx", "multiplayer", "networking", "plugins", "mcp", "code-editor", "scripting", "orchestration", "ai-assisted-development", "documentation", "docs-site"],
  "quality": {"performance": "high", "accessibility": true, "security": "high"},
  "risk": ["performance-critical", "security"],
  "ai": {
    "orchestrator": "native",
    "autonomy": "agentic",
    "preferred_models": [
      {"id": "openai/gpt-5.6-sol", "provider": "openai"},
      {"id": "deepseek/v4-pro", "provider": "deepseek"},
      {"id": "minimax/m3", "provider": "minimax"},
      {"id": "zai/glm-5.2", "provider": "zai"},
      {"id": "xai/grok-4.5", "provider": "xai"},
      {"id": "moonshot/kimi-k3", "provider": "moonshot"}
    ]
  }
}
